{
  "cell_id": "BILLS_EVTOL_VAH16",
  "source_cell_id": "VAH16",
  "source": "BILLS",
  "manufacturer": "Sony-Murata",
  "model_number": "US18650VTC6",
  "chemistry": "NMC",
  "cathode": "NMC",
  "anode": "graphite",
  "electrolyte": null,
  "form_factor": "cylindrical",
  "nominal_capacity_Ah": 3.0,
  "nominal_voltage_V": 3.6,
  "max_voltage_V": 4.2,
  "min_voltage_V": 2.5
}